{
  "$schema": "https://json-schema.org/draft/2020-12/schema",
  "description": "Generic Process Profile (OGC 14-065 WPS 2.0.2 \u00a77.5.2): \"the abstract interface of a process... declares a signature for process inputs and outputs.\" One Generic Profile per signature: several operations sharing the identical I/O shape (the seven binary spatial predicates, for instance) share one Generic Profile and differ only at Implementation Profile; `broader` links it to the Process Concept (generic-profiles.concept.*) documenting the general group it belongs to.\nImplementation Profiles and Implementations (instance level) -- concrete, deployable processes binding a Generic Profile to real formats -- are not part of this register; they live wherever the implementation itself is profiled (e.g. `ospd.process-profiles.sqlmm.*`) and link back here via their own `implementsProfile` property. This register does not cross-reference them.\n`inputs`/`outputs` use a subset of OGC API - Processes - Part 1: Core's own `InputDescription`/`OutputDescription` structure (`title`, `description`, `keywords`, `minOccurs`/`maxOccurs`) rather than a custom vocabulary invented for this register: this project already imports and uses that structure at Implementation (instance level) (`ogc.api.processes.v1.schemas.*`), so reusing it here makes all four tiers structurally, not just conceptually, consistent. There is deliberately no type/format property at this tier: [OGC 14-065 WPS 2.0.2 \u00a77.5.4 Table 21](https://docs.ogc.org/is/14-065/14-065.html#32) gives Generic Profile no \"Data format\" row at all (only Implementation Profile does, \"D\") -- what WPS \u00a77.5.2 calls a \"signature\" is the existence, naming and multiplicity of inputs/outputs, conveyed here in `title`/`description` prose, not a machine-checked abstract type.\nThis tier is where Table 21 Declares (D) every property it lists for the Process, its Inputs and its Outputs -- including `keywords` (Process, Input, Output) and `metadata` (Input, Output), both taken from OGC API - Processes' own `descriptionType` (whose `metadata` item, `ogc.api.processes.v1.schemas.metadata`, is WPS Table 5's Metadata structure: `title`, `role`, `href`). Profile-level references, with the Table 22 roles, are made once, on the process itself: here, to this Generic Profile's superior, its Process Concept (`http://www.opengis.net/spec/wps/2.0/def/process-profile/concept`) -- the list Table 21 footnote a requires the Implementation Profile to extend. An input's or output's own `metadata` only ever references the corresponding input/output of a superior profile; a Process Concept has none, so at this tier it is declared but normally empty.",
  "type": "object",
  "required": [
    "id",
    "type",
    "prefLabel",
    "definition",
    "inScheme",
    "status",
    "broader",
    "keywords",
    "metadata",
    "inputs",
    "outputs"
  ],
  "properties": {
    "id": {
      "type": "string",
      "format": "uri",
      "x-jsonld-id": "@id"
    },
    "type": {
      "const": "GenericProfile",
      "x-jsonld-id": "@type"
    },
    "prefLabel": {
      "type": "string",
      "x-jsonld-id": "http://www.w3.org/2004/02/skos/core#prefLabel"
    },
    "definition": {
      "type": "string",
      "x-jsonld-id": "http://www.w3.org/2004/02/skos/core#definition"
    },
    "inScheme": {
      "type": "string",
      "format": "uri",
      "x-jsonld-id": "http://www.w3.org/2004/02/skos/core#inScheme",
      "x-jsonld-type": "@id"
    },
    "status": {
      "type": "string",
      "enum": [
        "submitted",
        "valid",
        "invalid",
        "superseded",
        "retired"
      ],
      "x-jsonld-id": "https://geolabs.github.io/bblocks-generic-profiles/def/status"
    },
    "broader": {
      "description": "The Process Concept(s) (generic-profiles.concept.*) documenting the general group this operation belongs to.",
      "type": "array",
      "minItems": 1,
      "items": {
        "type": "string",
        "format": "uri"
      },
      "x-jsonld-id": "http://www.w3.org/2004/02/skos/core#broader",
      "x-jsonld-type": "@id"
    },
    "keywords": {
      "description": "Table 21 Process.Keywords (D). Each Implementation Profile must keep all of them (E).",
      "type": "array",
      "minItems": 1,
      "items": {
        "type": "string"
      },
      "x-jsonld-id": "https://w3id.org/ogc/api/processes/keywords"
    },
    "metadata": {
      "description": "Table 21 Process.Metadata (D): references to superior profiles, with Table 22 roles -- here the Process Concept(s) of `broader`.",
      "type": "array",
      "items": {
        "$ref": "https://geolabs.github.io/bblocks-ogcapi-processes/build/annotated/api/processes/v1/schemas/metadata/schema.json"
      },
      "contains": {
        "type": "object",
        "required": [
          "role",
          "href"
        ],
        "properties": {
          "role": {
            "const": "http://www.opengis.net/spec/wps/2.0/def/process-profile/concept",
            "x-jsonld-id": "https://w3id.org/ogc/api/processes/role",
            "x-jsonld-type": "@id"
          }
        }
      },
      "x-jsonld-id": "https://w3id.org/ogc/api/processes/metadata",
      "x-jsonld-extra-terms": {
        "title": "http://purl.org/dc/terms/title",
        "href": {
          "x-jsonld-id": "https://w3id.org/ogc/api/processes/href",
          "x-jsonld-type": "@id"
        }
      }
    },
    "source": {
      "type": "array",
      "items": {
        "type": "object",
        "required": [
          "title"
        ],
        "properties": {
          "title": {
            "type": "string",
            "x-jsonld-id": "http://purl.org/dc/terms/title"
          },
          "link": {
            "type": "string",
            "format": "uri",
            "x-jsonld-id": "http://purl.org/dc/terms/references",
            "x-jsonld-type": "@id"
          },
          "clause": {
            "type": "string",
            "x-jsonld-id": "https://geolabs.github.io/bblocks-generic-profiles/def/clause"
          }
        }
      },
      "x-jsonld-id": "http://purl.org/dc/terms/source"
    },
    "inputs": {
      "description": "Keyed by role name. A subset of OGC API - Processes Part 1 Core's own InputDescription: `title`/`description` carry the \"signature\" informally, `minOccurs`/`maxOccurs` are the one machine-checkable property this tier actually has (Table 21: Input.Multiplicity, D).",
      "type": "object",
      "minProperties": 1,
      "additionalProperties": {
        "type": "object",
        "required": [
          "id",
          "dataType",
          "title",
          "keywords"
        ],
        "properties": {
          "dataType": {
            "description": "What kind of data this input is, as a concept of the generic-profiles.data-type vocabulary (`https://geolabs.github.io/bblocks-generic-profiles/def/data-type/...`). Not a data format: Table 21 gives this tier none; an Implementation Profile may narrow it (e.g. `raster` to `raster-single-band`, `geometry` to `surface`).",
            "type": "string",
            "format": "uri",
            "x-jsonld-id": "http://purl.org/dc/terms/type",
            "x-jsonld-type": "@id"
          },
          "id": {
            "description": "This input's own IRI, `<profile id>/inputs/<name>` -- what a lower tier's metadata `href` points at.",
            "type": "string",
            "format": "uri",
            "x-jsonld-id": "@id"
          },
          "title": {
            "type": "string",
            "x-jsonld-id": "http://purl.org/dc/terms/title"
          },
          "description": {
            "type": "string",
            "x-jsonld-id": "http://purl.org/dc/terms/description"
          },
          "keywords": {
            "type": "array",
            "minItems": 1,
            "items": {
              "type": "string"
            },
            "x-jsonld-id": "https://w3id.org/ogc/api/processes/keywords"
          },
          "metadata": {
            "description": "Table 21 Input.Metadata (D). References to the corresponding input of a superior profile only; a Process Concept has no inputs, so normally empty at this tier.",
            "type": "array",
            "items": {
              "$ref": "https://geolabs.github.io/bblocks-ogcapi-processes/build/annotated/api/processes/v1/schemas/metadata/schema.json"
            },
            "x-jsonld-id": "https://w3id.org/ogc/api/processes/metadata",
            "x-jsonld-extra-terms": {
              "title": "http://purl.org/dc/terms/title",
              "role": {
                "x-jsonld-id": "https://w3id.org/ogc/api/processes/role",
                "x-jsonld-type": "@id"
              },
              "href": {
                "x-jsonld-id": "https://w3id.org/ogc/api/processes/href",
                "x-jsonld-type": "@id"
              }
            }
          },
          "minOccurs": {
            "type": "integer",
            "default": 1,
            "x-jsonld-id": "https://w3id.org/ogc/api/processes/minOccurs"
          },
          "maxOccurs": {
            "default": 1,
            "oneOf": [
              {
                "type": "integer"
              },
              {
                "const": "unbounded"
              }
            ],
            "x-jsonld-id": "https://w3id.org/ogc/api/processes/maxOccurs"
          }
        }
      },
      "x-jsonld-id": "https://geolabs.github.io/bblocks-generic-profiles/def/inputs",
      "x-jsonld-vocab": "https://geolabs.github.io/bblocks-generic-profiles/def/generic-profile/inputs/"
    },
    "outputs": {
      "description": "Keyed by role name. No `minOccurs`/`maxOccurs` -- Table 21 has no Output.Multiplicity row (and, per the same reasoning as the earlier `cardinality`-on-outputs mistake this replaces, an output's internal structure, e.g. a raster's band count, is not an output cardinality either way; see generic-profiles.implementation-profile.raster-band-math-multiband's `description.md`).",
      "type": "object",
      "minProperties": 1,
      "additionalProperties": {
        "type": "object",
        "required": [
          "id",
          "dataType",
          "title",
          "keywords"
        ],
        "properties": {
          "dataType": {
            "description": "What kind of data this output is, as a concept of the generic-profiles.data-type vocabulary (`https://geolabs.github.io/bblocks-generic-profiles/def/data-type/...`). Not a data format: Table 21 gives this tier none; an Implementation Profile may narrow it (e.g. `raster` to `raster-single-band`, `geometry` to `surface`).",
            "type": "string",
            "format": "uri",
            "x-jsonld-id": "http://purl.org/dc/terms/type",
            "x-jsonld-type": "@id"
          },
          "id": {
            "description": "This output's own IRI, `<profile id>/outputs/<name>` -- what a lower tier's metadata `href` points at.",
            "type": "string",
            "format": "uri",
            "x-jsonld-id": "@id"
          },
          "title": {
            "type": "string",
            "x-jsonld-id": "http://purl.org/dc/terms/title"
          },
          "description": {
            "type": "string",
            "x-jsonld-id": "http://purl.org/dc/terms/description"
          },
          "keywords": {
            "type": "array",
            "minItems": 1,
            "items": {
              "type": "string"
            },
            "x-jsonld-id": "https://w3id.org/ogc/api/processes/keywords"
          },
          "metadata": {
            "description": "Table 21 Output.Metadata (D, then O below: no footnote a). As for inputs, normally empty at this tier.",
            "type": "array",
            "items": {
              "$ref": "https://geolabs.github.io/bblocks-ogcapi-processes/build/annotated/api/processes/v1/schemas/metadata/schema.json"
            },
            "x-jsonld-id": "https://w3id.org/ogc/api/processes/metadata",
            "x-jsonld-extra-terms": {
              "title": "http://purl.org/dc/terms/title",
              "role": {
                "x-jsonld-id": "https://w3id.org/ogc/api/processes/role",
                "x-jsonld-type": "@id"
              },
              "href": {
                "x-jsonld-id": "https://w3id.org/ogc/api/processes/href",
                "x-jsonld-type": "@id"
              }
            }
          }
        }
      },
      "x-jsonld-id": "https://geolabs.github.io/bblocks-generic-profiles/def/outputs",
      "x-jsonld-vocab": "https://geolabs.github.io/bblocks-generic-profiles/def/generic-profile/outputs/"
    }
  },
  "x-jsonld-extra-terms": {
    "GenericProfile": "http://www.w3.org/2004/02/skos/core#Concept"
  },
  "x-jsonld-prefixes": {
    "skos": "http://www.w3.org/2004/02/skos/core#",
    "gp": "https://geolabs.github.io/bblocks-generic-profiles/def/",
    "proc": "https://w3id.org/ogc/api/processes/",
    "dct": "http://purl.org/dc/terms/"
  }
}