{
  "id": "https://geolabs.github.io/bblocks-generic-profiles/def/generic-profile/geometry-buffer",
  "type": "GenericProfile",
  "prefLabel": "Geometry buffer",
  "definition": "Computes a new geometry from one input geometry and a scalar distance. A different shape from binary-spatial-operation: one Geometry, one Number, not two Geometries.",
  "inScheme": "https://geolabs.github.io/bblocks-generic-profiles/def/generic-profile",
  "status": "submitted",
  "broader": [
    "https://geolabs.github.io/bblocks-generic-profiles/def/concept/vector-geometry-processing"
  ],
  "keywords": [
    "vector",
    "geometry",
    "spatial analysis",
    "buffer"
  ],
  "metadata": [
    {
      "title": "Process Concept: Vector Geometry Processing",
      "role": "http://www.opengis.net/spec/wps/2.0/def/process-profile/concept",
      "href": "https://geolabs.github.io/bblocks-generic-profiles/def/concept/vector-geometry-processing"
    }
  ],
  "inputs": {
    "geometry": {
      "id": "https://geolabs.github.io/bblocks-generic-profiles/def/generic-profile/geometry-buffer/inputs/geometry",
      "dataType": "https://geolabs.github.io/bblocks-generic-profiles/def/data-type/geometry",
      "title": "Geometry",
      "description": "the input geometry",
      "keywords": [
        "geometry"
      ]
    },
    "distance": {
      "id": "https://geolabs.github.io/bblocks-generic-profiles/def/generic-profile/geometry-buffer/inputs/distance",
      "dataType": "https://geolabs.github.io/bblocks-generic-profiles/def/data-type/number",
      "title": "Number",
      "description": "the buffer distance",
      "keywords": [
        "distance"
      ]
    }
  },
  "outputs": {
    "result": {
      "id": "https://geolabs.github.io/bblocks-generic-profiles/def/generic-profile/geometry-buffer/outputs/result",
      "dataType": "https://geolabs.github.io/bblocks-generic-profiles/def/data-type/geometry",
      "title": "Geometry",
      "description": "the buffered geometry",
      "keywords": [
        "geometry"
      ]
    }
  }
}
