{
  "id": "https://geolabs.github.io/bblocks-generic-profiles/def/generic-profile/raster-reprojection",
  "type": "GenericProfile",
  "prefLabel": "Raster reprojection",
  "definition": "Reprojects a raster coverage to another coordinate reference system, preserving its content. One Raster input, a target CRS, one Raster output in the new CRS.",
  "inScheme": "https://geolabs.github.io/bblocks-generic-profiles/def/generic-profile",
  "status": "submitted",
  "broader": [
    "https://geolabs.github.io/bblocks-generic-profiles/def/concept/raster-coverage-processing"
  ],
  "keywords": [
    "raster",
    "coverage",
    "reprojection"
  ],
  "metadata": [
    {
      "title": "Process Concept: Raster Coverage Processing",
      "role": "http://www.opengis.net/spec/wps/2.0/def/process-profile/concept",
      "href": "https://geolabs.github.io/bblocks-generic-profiles/def/concept/raster-coverage-processing"
    }
  ],
  "inputs": {
    "raster": {
      "id": "https://geolabs.github.io/bblocks-generic-profiles/def/generic-profile/raster-reprojection/inputs/raster",
      "dataType": "https://geolabs.github.io/bblocks-generic-profiles/def/data-type/raster",
      "title": "Raster",
      "description": "the input raster coverage",
      "keywords": [
        "raster"
      ]
    },
    "targetCRS": {
      "id": "https://geolabs.github.io/bblocks-generic-profiles/def/generic-profile/raster-reprojection/inputs/targetCRS",
      "dataType": "https://geolabs.github.io/bblocks-generic-profiles/def/data-type/string",
      "title": "String",
      "description": "the target coordinate reference system identifier",
      "keywords": [
        "CRS"
      ]
    }
  },
  "outputs": {
    "raster": {
      "id": "https://geolabs.github.io/bblocks-generic-profiles/def/generic-profile/raster-reprojection/outputs/raster",
      "dataType": "https://geolabs.github.io/bblocks-generic-profiles/def/data-type/raster",
      "title": "Raster",
      "description": "the reprojected raster coverage",
      "keywords": [
        "raster"
      ]
    }
  }
}