{
  "id": "https://geolabs.github.io/bblocks-generic-profiles/def/generic-profile/terrain-derivative",
  "type": "GenericProfile",
  "prefLabel": "Terrain derivative",
  "definition": "Derives one terrain attribute, as a single-band raster, from an elevation model. One elevation model input, one single-band raster output. Covers operations that differ only in the attribute computed (slope, aspect, curvature, terrain ruggedness, topographic position), not in signature.",
  "inScheme": "https://geolabs.github.io/bblocks-generic-profiles/def/generic-profile",
  "status": "submitted",
  "broader": [
    "https://geolabs.github.io/bblocks-generic-profiles/def/concept/terrain-analysis"
  ],
  "keywords": [
    "terrain",
    "elevation",
    "raster",
    "derivative"
  ],
  "metadata": [
    {
      "title": "Process Concept: Terrain Analysis",
      "role": "http://www.opengis.net/spec/wps/2.0/def/process-profile/concept",
      "href": "https://geolabs.github.io/bblocks-generic-profiles/def/concept/terrain-analysis"
    }
  ],
  "inputs": {
    "elevation": {
      "id": "https://geolabs.github.io/bblocks-generic-profiles/def/generic-profile/terrain-derivative/inputs/elevation",
      "dataType": "https://geolabs.github.io/bblocks-generic-profiles/def/data-type/elevation-model",
      "title": "Elevation model",
      "description": "the elevation model",
      "keywords": [
        "elevation"
      ]
    }
  },
  "outputs": {
    "result": {
      "id": "https://geolabs.github.io/bblocks-generic-profiles/def/generic-profile/terrain-derivative/outputs/result",
      "dataType": "https://geolabs.github.io/bblocks-generic-profiles/def/data-type/raster-single-band",
      "title": "Raster",
      "description": "the derived terrain attribute",
      "keywords": [
        "raster"
      ]
    }
  }
}