{
  "id": "https://geolabs.github.io/bblocks-generic-profiles/def/generic-profile/point-cloud-rasterization",
  "type": "GenericProfile",
  "prefLabel": "Point cloud rasterization",
  "definition": "Converts a point cloud to a raster on a grid of a given cell size. One point cloud and one cell size in, one raster out.",
  "inScheme": "https://geolabs.github.io/bblocks-generic-profiles/def/generic-profile",
  "status": "submitted",
  "broader": [
    "https://geolabs.github.io/bblocks-generic-profiles/def/concept/point-cloud-processing"
  ],
  "keywords": [
    "point cloud",
    "raster",
    "rasterization"
  ],
  "metadata": [
    {
      "title": "Process Concept: Point Cloud Processing",
      "role": "http://www.opengis.net/spec/wps/2.0/def/process-profile/concept",
      "href": "https://geolabs.github.io/bblocks-generic-profiles/def/concept/point-cloud-processing"
    }
  ],
  "inputs": {
    "points": {
      "id": "https://geolabs.github.io/bblocks-generic-profiles/def/generic-profile/point-cloud-rasterization/inputs/points",
      "dataType": "https://geolabs.github.io/bblocks-generic-profiles/def/data-type/point-cloud",
      "title": "Point cloud",
      "description": "the input point cloud",
      "keywords": [
        "point cloud"
      ]
    },
    "cellSize": {
      "id": "https://geolabs.github.io/bblocks-generic-profiles/def/generic-profile/point-cloud-rasterization/inputs/cellSize",
      "dataType": "https://geolabs.github.io/bblocks-generic-profiles/def/data-type/number",
      "title": "Number",
      "description": "the cell size of the output grid",
      "keywords": [
        "cell size"
      ]
    }
  },
  "outputs": {
    "result": {
      "id": "https://geolabs.github.io/bblocks-generic-profiles/def/generic-profile/point-cloud-rasterization/outputs/result",
      "dataType": "https://geolabs.github.io/bblocks-generic-profiles/def/data-type/raster",
      "title": "Raster",
      "description": "the point cloud's attribute(s) on the grid",
      "keywords": [
        "raster"
      ]
    }
  }
}
