{
  "id": "https://geolabs.github.io/bblocks-generic-profiles/def/generic-profile/point-cloud-to-features",
  "type": "GenericProfile",
  "prefLabel": "Point cloud to features",
  "definition": "Converts a point cloud to a feature collection. One point cloud in, one feature collection out.",
  "inScheme": "https://geolabs.github.io/bblocks-generic-profiles/def/generic-profile",
  "status": "submitted",
  "broader": [
    "https://geolabs.github.io/bblocks-generic-profiles/def/concept/point-cloud-processing"
  ],
  "keywords": [
    "point cloud",
    "feature collection",
    "conversion"
  ],
  "metadata": [
    {
      "title": "Process Concept: Point Cloud Processing",
      "role": "http://www.opengis.net/spec/wps/2.0/def/process-profile/concept",
      "href": "https://geolabs.github.io/bblocks-generic-profiles/def/concept/point-cloud-processing"
    }
  ],
  "inputs": {
    "points": {
      "id": "https://geolabs.github.io/bblocks-generic-profiles/def/generic-profile/point-cloud-to-features/inputs/points",
      "dataType": "https://geolabs.github.io/bblocks-generic-profiles/def/data-type/point-cloud",
      "title": "Point cloud",
      "description": "the input point cloud",
      "keywords": [
        "point cloud"
      ]
    }
  },
  "outputs": {
    "result": {
      "id": "https://geolabs.github.io/bblocks-generic-profiles/def/generic-profile/point-cloud-to-features/outputs/result",
      "dataType": "https://geolabs.github.io/bblocks-generic-profiles/def/data-type/feature-collection",
      "title": "Feature collection",
      "description": "one feature per point, its attributes as feature attributes",
      "keywords": [
        "feature collection"
      ]
    }
  }
}
